{
  "schema_version": "2.0.0",
  "meta": {
    "date": "2025-07-28T00:00:00Z",
    "project": "ewm-modal-cta",
    "author": "augment_agent",
    "task_id": "WC_INTEGRATION_COMPLETE",
    "status": "done",
    "revision": 2,
    "snapshot_id": "50ca4ef1-d3b3-4a0f-81b3-e6ef3509431a",
    "group_id": "planes_pendientes",
    "can_agent_set_done": true,
    "timestamp": "2025-07-28T01:17:39.255695Z",
    "rolled_back": false,
    "group_md": "groups/planes_pendientes/group.md"
  },
  "scope": {
    "files": [
      "includes/class-ewm-admin-page.php",
      "assets/js/wc-builder-integration.js",
      "assets/js/modal-admin.js"
    ],
    "components": [
      "WooCommerce Integration",
      "Modal Builder",
      "Admin Interface"
    ]
  },
  "problem": {
    "user_request": "Integraci贸n completa de WooCommerce en el builder del modal CTA con funcionalidades avanzadas",
    "business_goal": "Permitir configuraci贸n avanzada de modales CTA con integraci贸n nativa de WooCommerce",
    "constraints": [
      "Mantener compatibilidad con funcionalidad existente",
      "Seguir WordPress Coding Standards",
      "Usar WP-CLI para desarrollo"
    ]
  },
  "implementation_plan": {
    "steps": [
      {
        "step": "Integrar funcionalidades WooCommerce en builder",
        "status": "done"
      },
      {
        "step": "Actualizar archivos JavaScript del admin",
        "status": "done"
      },
      {
        "step": "Validar funcionalidad completa",
        "status": "done"
      }
    ]
  },
  "next_actions": [
    "Proceder con implementaci贸n del sistema de cupones inteligentes",
    "Crear nuevo grupo de tareas para el plan de arquitectura",
    "Iniciar Sprint 1: Infraestructura base"
  ]
}