{
  "schema_version": "2.0.0",
  "meta": {
    "date": "2025-07-23T05:30:00Z",
    "project": "ewm-modal-cta",
    "author": "augment_agent",
    "task_id": "DISPLAY_RULES_ENABLED_DEBUG",
    "status": "done",
    "revision": 2,
    "snapshot_id": "357c5913-1217-4a91-8999-c75b49f3fec2",
    "group_id": "builder_modal_issues",
    "can_agent_set_done": true,
    "rolled_back": false,
    "timestamp": "2025-07-23T05:10:02.911314Z",
    "group_md": "groups/builder_modal_issues/group.md"
  },
  "scope": {
    "files": [
      "includes/class-ewm-meta-fields.php"
    ],
    "components": [
      "validate_display_rules",
      "EWM_Meta_Fields"
    ]
  },
  "problem": {
    "user_request": "Documentar hallazgos sobre la persistencia y recuperación del campo display_rules.enabled.",
    "business_goal": "Asegurar la consistencia y trazabilidad del estado 'Modal Activo' en el builder."
  },
  "analysis": {
    "root_cause": "El método validate_display_rules() no incluía el campo 'enabled', causando que PHP omitiera la clave cuando el valor era false",
    "hypotheses": [
      "Problema de serialización PHP",
      "Falta de validación de estructura",
      "Inconsistencia en contratos de datos"
    ]
  },
  "implementation_plan": {
    "steps": [
      {
        "step": "Analizar código actual y identificar problema",
        "status": "done"
      },
      {
        "step": "Revisar otros campos booleanos",
        "status": "done"
      },
      {
        "step": "Implementar contrato de datos",
        "status": "done"
      },
      {
        "step": "Probar solución",
        "status": "todo"
      }
    ]
  },
  "next_actions": [
    "Probar la funcionalidad en el builder",
    "Verificar que el checkbox 'Modal Activo' mantiene su estado",
    "Confirmar que no hay regresiones en otros campos"
  ]
}