{
  "schema_version": "2.0.0",
  "meta": {
    "date": "2025-07-28T00:00:00Z",
    "project": "ewm-modal-cta",
    "author": "augment_agent",
    "task_id": "SPRINT1_INTEGRATION_TESTING",
    "status": "doing",
    "revision": 2,
    "snapshot_id": "81bbcec1-2058-4615-a873-731d80bf22d0",
    "group_id": "wc_modal_inteligente_implementacion",
    "can_agent_set_done": true,
    "timestamp": "2025-07-28T02:02:42.788606Z",
    "rolled_back": false,
    "group_md": "groups/wc_modal_inteligente_implementacion/group.md"
  },
  "scope": {
    "files": [
      "tests/test-ewm-coupon-manager.php",
      "tests/test-woocommerce-integration.php",
      "tests/test-security-validation.php",
      "tests/test-complete-integration.php"
    ],
    "components": [
      "Unit Testing",
      "Integration Testing",
      "Security Testing",
      "Performance Testing",
      "End-to-End Testing"
    ]
  },
  "problem": {
    "user_request": "Crear suite completa de pruebas para validar funcionalidad, integración WooCommerce y seguridad",
    "business_goal": "Asegurar calidad y confiabilidad del sistema antes de proceder al frontend",
    "constraints": [
      "Cobertura de tests > 90%",
      "Tests automatizados",
      "Validación con diferentes tipos de cupones"
    ]
  },
  "implementation_plan": {
    "steps": [
      {
        "step": "Crear tests unitarios para coupon manager",
        "status": "done",
        "estimated_time": "2h"
      },
      {
        "step": "Crear tests de integración WooCommerce",
        "status": "done",
        "estimated_time": "2h"
      },
      {
        "step": "Crear tests de seguridad",
        "status": "done",
        "estimated_time": "1h 30min"
      },
      {
        "step": "Testing con diferentes tipos de cupones",
        "status": "doing",
        "estimated_time": "2h"
      },
      {
        "step": "Validar edge cases",
        "status": "todo",
        "estimated_time": "1h 30min"
      },
      {
        "step": "Performance benchmarking",
        "status": "todo",
        "estimated_time": "1h"
      }
    ]
  },
  "next_actions": [
    "Crear tests para diferentes tipos de cupones",
    "Validar edge cases complejos",
    "Ejecutar benchmarking completo"
  ]
}