{
  "schema_version": "1.0.0",
  "meta": {
    "task_id": "EWM_ARCHITECTURE_ANALYSIS_20250719",
    "status": "done",
    "date": "2025-07-19T09:45:00Z",
    "project": "ewm-modal-cta",
    "author": "augment_agent"
  },
  "scope": {
    "files": [
      "ewm-modal-cta.php",
      "includes/class-ewm-shortcodes.php",
      "includes/class-ewm-render-core.php",
      "includes/class-ewm-block-processor.php",
      "includes/class-ewm-rest-api.php",
      "includes/class-ewm-woocommerce.php",
      "includes/class-ewm-admin-page.php",
      "src/ewm-modal-cta/block.json",
      "src/ewm-modal-cta/edit.js",
      "build/ewm-modal-cta/render.php",
      "docs/prd.txt"
    ],
    "components": [
      "Sistema Dual Gutenberg+Shortcodes",
      "Motor Renderizado Universal",
      "REST API ewm/v1",
      "Integración WooCommerce",
      "Block Processor",
      "Admin Builder",
      "Sistema Logging"
    ]
  },
  "problem": {
    "user_request": "Revisar el proyecto especialmente la arquitectura dual (Gutenberg + clásica) para crear/manejar endpoints y modales, identificar integraciones y crear memoria de contexto",
    "business_goal": "Documentar completamente la arquitectura dual del plugin EWM Modal CTA para facilitar desarrollo y mantenimiento",
    "constraints": [
      "Mantener compatibilidad con ambos enfoques",
      "Seguir estándares WordPress",
      "Preservar funcionalidad existente"
    ]
  },
  "analysis": {
    "root_cause": "Necesidad de documentar la arquitectura compleja del sistema dual",
    "hypotheses": [
      "El proyecto implementa una arquitectura dual sofisticada",
      "Ambos enfoques comparten motor de renderizado universal",
      "Sistema API-First permite escalabilidad"
    ],
    "tradeoffs": [
      "Complejidad arquitectural vs flexibilidad de uso",
      "Mantenimiento dual vs compatibilidad amplia",
      "Performance vs funcionalidad completa"
    ]
  },
  "implementation_plan": {
    "steps": [
      {
        "step": "Analizar archivos principales del plugin",
        "status": "done",
        "estimated_time": "45min"
      },
      {
        "step": "Identificar arquitectura dual",
        "status": "done",
        "estimated_time": "30min"
      },
      {
        "step": "Mapear integraciones y endpoints",
        "status": "done",
        "estimated_time": "30min"
      },
      {
        "step": "Crear memoria de contexto",
        "status": "done",
        "estimated_time": "30min"
      },
      {
        "step": "Documentar arquitectura completa",
        "status": "doing",
        "estimated_time": "30min"
      }
    ],
    "md_reference": "docs/memory/EWM_ARCHITECTURE_ANALYSIS_20250719.md"
  },
  "experiments": [
    {
      "test_case": "Revisar motor de renderizado universal",
      "result": "Confirmado: clase EWM_Render_Core unifica ambos enfoques",
      "logs_link": "includes/class-ewm-render-core.php:render_modal()"
    },
    {
      "test_case": "Validar auto-generación shortcodes",
      "result": "Confirmado: Block Processor genera shortcodes automáticamente",
      "logs_link": "includes/class-ewm-block-processor.php"
    }
  ],
  "strategies_tried": [],
  "open_questions": [],
  "next_actions": [
    "Crear documentación arquitectural detallada",
    "Mapear flujos de datos completos",
    "Documentar endpoints REST API",
    "Revisar configuración de permisos"
  ],
  "links": {
    "docs": [
      "docs/prd.txt",
      "docs/guia_wp.md"
    ],
    "tickets": [],
    "designs": [],
    "runs": []
  }
}