{
  "schema_version": "2.0.0",
  "meta": {
    "date": "2025-07-22T00:00:00Z",
    "project": "ewm-modal-cta",
    "author": "augment_agent",
    "task_id": "UNIFICAR_ESTRUCTURA_FREQUENCY_20250722",
    "status": "doing",
    "revision": 1,
    "snapshot_id": "da239956-6908-42fd-901b-ce67a99bdd91",
    "group_id": "investigacion_backend_persistencia",
    "timestamp": "2025-07-22T00:59:05.633107Z",
    "can_agent_set_done": true,
    "rolled_back": false,
    "group_md": "groups/investigacion_backend_persistencia/group.md"
  },
  "scope": {
    "files": [
      "assets/js/modal-admin.js"
    ],
    "components": [
      "JavaScript Frontend",
      "Data Structure",
      "Form Handling",
      "AJAX Communication"
    ]
  },
  "problem": {
    "user_request": "Implementar la unificación de estructura para que el frontend envíe frequency: {type, limit} en lugar de frequency_type, logrando que backend y frontend hablen el mismo idioma",
    "business_goal": "Resolver definitivamente el problema de persistencia de datos del campo frecuencia",
    "constraints": [
      "No hay restricciones de retrocompatibilidad",
      "Mantener el backend sin cambios",
      "Seguir recomendaciones del consultor externo"
    ]
  },
  "analysis": {
    "root_cause": "Frontend envía frequency_type pero backend espera frequency: {type, limit}",
    "hypotheses": [
      "Cambiar collectTriggersData() para enviar estructura completa",
      "Actualizar populateForm() para leer frequency.type",
      "Mantener logs para verificar funcionamiento"
    ]
  },
  "implementation_plan": {
    "steps": [
      {
        "step": "Modificar collectTriggersData() para enviar frequency: {type, limit}",
        "status": "todo"
      },
      {
        "step": "Actualizar populateForm() para leer frequency.type en lugar de frequency_type",
        "status": "todo"
      },
      {
        "step": "Actualizar logs para reflejar nueva estructura",
        "status": "todo"
      },
      {
        "step": "Probar la nueva implementación con logs detallados",
        "status": "todo"
      },
      {
        "step": "Verificar que los datos persisten correctamente en BD",
        "status": "todo"
      }
    ]
  },
  "open_questions": [
    "¿Necesitamos manejar datos existentes con estructura antigua?",
    "¿El campo limit debe ser configurable o siempre 1?"
  ],
  "next_actions": [
    "Modificar collectTriggersData() en modal-admin.js",
    "Actualizar populateForm() para nueva estructura",
    "Mantener logging detallado para verificación",
    "Probar guardado y carga de datos"
  ]
}