{
  "schema_version": "2.0.0",
  "meta": {
    "date": "2025-07-28T00:00:00Z",
    "project": "ewm-modal-cta",
    "author": "augment_agent",
    "task_id": "SPRINT2_UI_UX_IMPLEMENTATION",
    "status": "todo",
    "revision": 1,
    "snapshot_id": "46810f38-4118-4626-940a-8b30817ce5ce",
    "group_id": "wc_modal_inteligente_implementacion",
    "can_agent_set_done": true,
    "timestamp": "2025-07-28T01:20:05.338914Z",
    "rolled_back": false,
    "group_md": "groups/wc_modal_inteligente_implementacion/group.md"
  },
  "scope": {
    "files": [
      "templates/modal-coupon-display.php",
      "templates/coupon-item.php",
      "assets/css/ewm-coupon-modal.css"
    ],
    "components": [
      "Modal Templates",
      "CSS Styling",
      "Responsive Design",
      "Accessibility"
    ]
  },
  "problem": {
    "user_request": "Crear templates de modal y CSS con diseño responsive y accesible",
    "business_goal": "Proporcionar experiencia de usuario óptima para aplicación de cupones",
    "constraints": [
      "Responsive design obligatorio",
      "Accesibilidad WCAG 2.1 AA",
      "Integración con estilos existentes"
    ]
  },
  "implementation_plan": {
    "steps": [
      {
        "step": "Crear templates de modal",
        "status": "todo",
        "estimated_time": "2h"
      },
      {
        "step": "Implementar CSS y animaciones",
        "status": "todo",
        "estimated_time": "2h 30min"
      },
      {
        "step": "Responsive design",
        "status": "todo",
        "estimated_time": "2h"
      },
      {
        "step": "Accessibility compliance",
        "status": "todo",
        "estimated_time": "1h 30min"
      }
    ]
  },
  "next_actions": [
    "Crear template modal-coupon-display.php",
    "Diseñar CSS responsive",
    "Implementar accesibilidad WCAG"
  ]
}