{
  "schema_version": "2.0.0",
  "meta": {
    "date": "2025-07-28T00:00:00Z",
    "project": "ewm-modal-cta",
    "author": "augment_agent",
    "task_id": "SPRINT2_INTEGRATION_FINAL",
    "status": "done",
    "revision": 2,
    "snapshot_id": "166a08f7-b946-486b-b67b-7516b56c3106",
    "group_id": "wc_modal_inteligente_implementacion",
    "can_agent_set_done": true,
    "timestamp": "2025-07-28T02:25:06.128957Z",
    "rolled_back": false,
    "group_md": "groups/wc_modal_inteligente_implementacion/group.md"
  },
  "scope": {
    "files": [
      "ewm-modal-cta.php",
      "assets/js/ewm-coupon-init.js",
      "tests/test-complete-system-integration.php",
      "README.md"
    ],
    "components": [
      "Asset Integration",
      "System Initialization",
      "Complete Testing",
      "Documentation"
    ]
  },
  "problem": {
    "user_request": "Integrar todos los componentes frontend/backend y realizar testing completo del sistema",
    "business_goal": "Asegurar funcionamiento completo del sistema de cupones inteligentes",
    "constraints": [
      "Integración sin conflictos",
      "Performance optimizado",
      "Compatibilidad WordPress"
    ]
  },
  "implementation_plan": {
    "steps": [
      {
        "step": "Integrar assets y dependencias",
        "status": "done",
        "estimated_time": "2h"
      },
      {
        "step": "Crear sistema de inicialización",
        "status": "done",
        "estimated_time": "1h 30min"
      },
      {
        "step": "Testing completo del sistema",
        "status": "done",
        "estimated_time": "2h"
      },
      {
        "step": "Documentación final",
        "status": "done",
        "estimated_time": "1h"
      }
    ]
  },
  "next_actions": [
    "Sistema completamente funcional",
    "Listo para producción",
    "Documentación completa disponible"
  ],
  "experiments": [
    {
      "test_case": "Integración completa frontend-backend",
      "result": "Workflow completo desde AJAX hasta WooCommerce funcionando perfectamente",
      "logs_link": "tests/test-complete-system-integration.php:test_complete_frontend_to_backend_workflow"
    },
    {
      "test_case": "Performance bajo carga",
      "result": "50 operaciones concurrentes en < 10s, memory usage < 50MB",
      "logs_link": "tests/test-complete-system-integration.php:test_system_performance_under_load"
    },
    {
      "test_case": "Asset loading y dependencias",
      "result": "CSS/JS cargando correctamente con dependencias resueltas",
      "logs_link": "ewm-modal-cta.php:ewm_enqueue_coupon_assets"
    }
  ]
}