{
  "schema_version": "2.0.0",
  "meta": {
    "date": "2025-07-22T00:00:00Z",
    "project": "ewm-modal-cta",
    "author": "augment_agent",
    "task_id": "UNIFICAR_ESTRUCTURA_FREQUENCY_20250722",
    "status": "doing",
    "revision": 3,
    "snapshot_id": "f3e4be4b-14ea-4e22-b3c1-fa700fa249db",
    "group_id": "investigacion_backend_persistencia",
    "timestamp": "2025-07-22T01:06:36.345419Z",
    "can_agent_set_done": true,
    "rolled_back": false,
    "group_md": "groups/investigacion_backend_persistencia/group.md"
  },
  "scope": {
    "files": [
      "assets/js/modal-admin.js",
      "includes/class-ewm-meta-fields.php"
    ],
    "components": [
      "JavaScript Frontend",
      "Data Structure",
      "Form Handling",
      "AJAX Communication",
      "PHP Backend Validation"
    ]
  },
  "problem": {
    "user_request": "Implementar la unificación de estructura para que el frontend envíe frequency: {type, limit} en lugar de frequency_type, logrando que backend y frontend hablen el mismo idioma",
    "business_goal": "Resolver definitivamente el problema de persistencia de datos del campo frecuencia",
    "constraints": [
      "No hay restricciones de retrocompatibilidad",
      "Mantener el backend sin cambios",
      "Seguir recomendaciones del consultor externo"
    ]
  },
  "analysis": {
    "root_cause": "Frontend envía frequency_type pero backend espera frequency: {type, limit}",
    "hypotheses": [
      "Cambiar collectTriggersData() para enviar estructura completa",
      "Actualizar populateForm() para leer frequency.type",
      "Mantener logs para verificar funcionamiento"
    ]
  },
  "implementation_plan": {
    "steps": [
      {
        "step": "Modificar collectTriggersData() para enviar frequency: {type, limit}",
        "status": "done"
      },
      {
        "step": "Actualizar populateForm() para leer frequency.type en lugar de frequency_type",
        "status": "done"
      },
      {
        "step": "Actualizar logs para reflejar nueva estructura",
        "status": "done"
      },
      {
        "step": "Corregir validación PHP: mover frequency de display_rules a trigger_config",
        "status": "done"
      },
      {
        "step": "Probar la nueva implementación con logs detallados",
        "status": "todo"
      },
      {
        "step": "Verificar que los datos persisten correctamente en BD",
        "status": "todo"
      }
    ]
  },
  "experiments": [
    {
      "test_case": "Modificación de collectTriggersData()",
      "result": "Cambiado de frequency_type a frequency: {type, limit} con lógica para determinar limit basado en type",
      "logs_link": "Ver código en assets/js/modal-admin.js línea ~370"
    },
    {
      "test_case": "Actualización de populateForm()",
      "result": "Cambiado para leer data.triggers.frequency?.type en lugar de frequency_type",
      "logs_link": "Ver código en assets/js/modal-admin.js línea ~430"
    },
    {
      "test_case": "Logs actualizados",
      "result": "Logs ahora muestran estructura unificada y verifican presencia del objeto frequency",
      "logs_link": "Ver logs en consola del navegador"
    },
    {
      "test_case": "Corrección validación PHP",
      "result": "Movido frequency de validate_display_rules() a validate_trigger_config() donde corresponde",
      "logs_link": "Ver código en includes/class-ewm-meta-fields.php línea ~470"
    }
  ],
  "strategies_tried": [
    {
      "strategy": "Traceback completo del flujo de datos",
      "outcome": "Exitoso - Identificó que la validación de frequency estaba en el lugar incorrecto",
      "reason_for_failure": "N/A - Estrategia exitosa"
    },
    {
      "strategy": "Corrección de validación PHP",
      "outcome": "Exitoso - Movido frequency de display_rules a trigger_config",
      "reason_for_failure": "N/A - Estrategia exitosa"
    }
  ],
  "open_questions": [
    "¿Necesitamos manejar datos existentes con estructura antigua?",
    "¿El campo limit debe ser configurable o siempre 1?"
  ],
  "next_actions": [
    "Probar la corrección completa en el modal admin",
    "Verificar que no hay errores PHP en logs",
    "Comprobar que los datos se guardan y cargan correctamente",
    "Verificar que los datos persisten al recargar"
  ]
}