{
  "schema_version": "2.0.0",
  "meta": {
    "date": "2025-07-28T00:00:00Z",
    "project": "ewm-modal-cta",
    "author": "augment_agent",
    "task_id": "SPRINT2_JAVASCRIPT_DEVELOPMENT",
    "status": "done",
    "revision": 3,
    "snapshot_id": "62b83ba4-f598-413e-90d0-5efbad988d9f",
    "group_id": "wc_modal_inteligente_implementacion",
    "can_agent_set_done": true,
    "timestamp": "2025-07-28T02:11:11.366100Z",
    "rolled_back": false,
    "group_md": "groups/wc_modal_inteligente_implementacion/group.md"
  },
  "scope": {
    "files": [
      "assets/js/ewm-coupon-modal.js",
      "assets/js/ewm-coupon-handler.js",
      "assets/js/ewm-coupon-error-handler.js",
      "assets/js/ewm-coupon-tests.js"
    ],
    "components": [
      "EWMCouponModal Class",
      "EWMCouponHandler Class",
      "Error Handling System",
      "Frontend Testing Suite"
    ]
  },
  "problem": {
    "user_request": "Desarrollar clases JavaScript para manejo del modal de cupones y comunicaci칩n AJAX",
    "business_goal": "Crear interfaz frontend robusta para aplicaci칩n de cupones",
    "constraints": [
      "JavaScript vanilla (sin dependencias externas)",
      "Compatibilidad cross-browser",
      "Error handling robusto"
    ]
  },
  "implementation_plan": {
    "steps": [
      {
        "step": "Implementar EWMCouponModal class",
        "status": "done",
        "estimated_time": "3h"
      },
      {
        "step": "Implementar EWMCouponHandler para AJAX",
        "status": "done",
        "estimated_time": "2h"
      },
      {
        "step": "Implementar error handling",
        "status": "done",
        "estimated_time": "1h 30min"
      },
      {
        "step": "Testing frontend b치sico",
        "status": "done",
        "estimated_time": "1h 30min"
      }
    ]
  },
  "next_actions": [
    "Proceder con SPRINT2_UI_UX_IMPLEMENTATION",
    "Crear templates CSS responsive",
    "Implementar animaciones y transiciones"
  ],
  "experiments": [
    {
      "test_case": "Suite completa de tests frontend",
      "result": "10+ tests unitarios, integraci칩n y performance - todos pasando",
      "logs_link": "assets/js/ewm-coupon-tests.js"
    },
    {
      "test_case": "Performance de renderizado",
      "result": "Modal creation < 50ms, coupon rendering < 100ms",
      "logs_link": "EWMCouponTests.testPerformance"
    },
    {
      "test_case": "Error handling robusto",
      "result": "Mensajes user-friendly, retry logic, logging estructurado",
      "logs_link": "assets/js/ewm-coupon-error-handler.js"
    }
  ]
}