{
  "schema_version": "2.0.0",
  "meta": {
    "date": "2025-07-23T06:30:00Z",
    "project": "ewm-modal-cta",
    "author": "augment_agent",
    "task_id": "ADD_MISSING_DISPLAY_RULES_FIELDS",
    "status": "doing",
    "revision": 1,
    "snapshot_id": "abea2dee-0f28-452a-9b87-523efb169808",
    "group_id": "gui_improvements_reorganization",
    "can_agent_set_done": true,
    "rolled_back": false,
    "timestamp": "2025-07-23T05:50:53.400117Z",
    "group_md": "groups/gui_improvements_reorganization/group.md"
  },
  "scope": {
    "files": [
      "includes/class-ewm-admin-page.php",
      "assets/js/modal-admin.js",
      "assets/css/modal-admin.css"
    ],
    "components": [
      "Modal Builder UI",
      "Display Rules",
      "Devices Controls",
      "Pages Controls",
      "User Roles Controls"
    ]
  },
  "problem": {
    "user_request": "Agregar campos faltantes en la UI para display_rules: devices (desktop/tablet/mobile), pages (include/exclude), y user_roles que existen en el contrato y BD pero no en la interfaz.",
    "business_goal": "Completar la funcionalidad de display_rules permitiendo a los usuarios configurar en qué dispositivos, páginas y roles de usuario mostrar los modales."
  },
  "analysis": {
    "root_cause": "La UI solo maneja el campo 'enabled' de display_rules, pero el contrato y BD esperan estructura completa con devices, pages y user_roles",
    "hypotheses": [
      "UI incompleta desde el desarrollo inicial",
      "Campos agregados al contrato pero no a la UI",
      "Funcionalidad planificada pero no implementada"
    ],
    "tradeoffs": [
      "UI simple vs funcionalidad completa",
      "Espacio en interfaz vs capacidades avanzadas"
    ]
  },
  "implementation_plan": {
    "steps": [
      {
        "step": "Analizar estructura actual de display_rules",
        "status": "done"
      },
      {
        "step": "Diseñar UI para campos devices",
        "status": "todo"
      },
      {
        "step": "Diseñar UI para campos pages",
        "status": "todo"
      },
      {
        "step": "Diseñar UI para campos user_roles",
        "status": "todo"
      },
      {
        "step": "Actualizar collectDisplayRules() en JavaScript",
        "status": "todo"
      },
      {
        "step": "Actualizar populateForm() en JavaScript",
        "status": "todo"
      },
      {
        "step": "Probar funcionalidad completa",
        "status": "todo"
      }
    ]
  },
  "next_actions": [
    "Agregar controles de devices (checkboxes)",
    "Agregar controles de pages (selects)",
    "Agregar controles de user_roles (multiselect)",
    "Actualizar JavaScript para manejar nuevos campos"
  ]
}