{
  "schema_version": "1.0.0",
  "meta": {
    "task_id": "FREQUENCY_BYPASS_IMPLEMENTATION_20250720",
    "status": "done",
    "date": "2025-07-20T02:10:00Z",
    "project": "ewm-modal-cta",
    "author": "agent_code"
  },
  "scope": {
    "files": [
      "src/ewm-modal-cta/edit.js",
      "includes/class-ewm-render-core.php",
      "assets/js/modal-frontend.js"
    ],
    "components": [
      "Gutenberg Block Editor",
      "Modal Rendering Core",
      "Frontend JavaScript",
      "Frequency Validation System"
    ]
  },
  "problem": {
    "user_request": "Implementar el plan del consultor para resolver el problema de bypass de debug mode y limpieza de cookies en el sistema de frecuencia de modales",
    "business_goal": "Hacer que el sistema de frecuencia funcione correctamente tanto para shortcodes como bloques, respetando el debug mode y limpiando cookies obsoletas",
    "constraints": [
      "No romper funcionalidad existente",
      "Mantener compatibilidad entre shortcodes y bloques",
      "Preservar performance"
    ]
  },
  "analysis": {
    "root_cause": "Dos sistemas de validación separados: Backend (PHP) respeta debug mode, Frontend (JavaScript) no lo respeta. Cookies obsoletas interfieren al cambiar configuración.",
    "hypotheses": [
      "Bypass incompleto en JavaScript",
      "Mapeo inconsistente de tipos de frecuencia",
      "Cookies persistentes causan conflictos"
    ],
    "tradeoffs": [
      "Debugging detallado vs performance",
      "Compatibilidad vs refactoring completo"
    ]
  },
  "implementation_plan": {
    "steps": [
      {
        "step": "Homologar tipos de frecuencia en Gutenberg",
        "status": "done",
        "estimated_time": "10min"
      },
      {
        "step": "Pasar estado del bypass al frontend",
        "status": "done",
        "estimated_time": "15min"
      },
      {
        "step": "Actualizar JavaScript para respetar bypass",
        "status": "done",
        "estimated_time": "10min"
      },
      {
        "step": "Implementar limpiador de cookies",
        "status": "done",
        "estimated_time": "20min"
      }
    ],
    "md_reference": "docs/memory/FREQUENCY_BYPASS_IMPLEMENTATION_20250720.md"
  },
  "experiments": [
    {
      "test_case": "Verificar mapeo de tipos de frecuencia",
      "result": "Corregido: day->daily, week->weekly en edit.js",
      "logs_link": ""
    },
    {
      "test_case": "Implementar bypass en frontend",
      "result": "Agregado check de window.ewmModal.frequencyDebug en hasBeenShown()",
      "logs_link": ""
    },
    {
      "test_case": "Sistema de cookies específicas por tipo",
      "result": "Implementado: ewm_modal_ID_count_TYPE en lugar de genérico",
      "logs_link": ""
    }
  ],
  "strategies_tried": [
    {
      "strategy": "Seguir plan detallado del consultor",
      "outcome": "Implementación exitosa de todos los 4 pasos",
      "reason_for_failure": "N/A"
    },
    {
      "strategy": "Homologar tipos de frecuencia",
      "outcome": "Corregido mapeo inconsistente entre admin y backend",
      "reason_for_failure": "N/A"
    },
    {
      "strategy": "Implementar bypass completo",
      "outcome": "Debug mode ahora funciona en frontend también",
      "reason_for_failure": "N/A"
    },
    {
      "strategy": "Sistema de limpieza de cookies",
      "outcome": "Cookies obsoletas se eliminan automáticamente",
      "reason_for_failure": "N/A"
    }
  ],
  "open_questions": [],
  "next_actions": [
    "Testing completo del sistema",
    "Verificar que funciona con todos los tipos de frecuencia",
    "Confirmar que bypass funciona correctamente"
  ],
  "links": {
    "docs": [],
    "tickets": [],
    "designs": [],
    "runs": []
  }
}