{
  "analysis": {
    "hypotheses": [
      "La implementación será similar a otros paneles existentes en edit.js",
      "El atributo displayRules ya existe y solo necesita UI",
      "La funcionalidad backend ya maneja la frecuencia correctamente"
    ],
    "root_cause": "Falta implementación de UI para el atributo displayRules.frequency en el editor de Gutenberg",
    "tradeoffs": [
      "Panel separado vs integrar en panel existente",
      "Mostrar todas las opciones vs opciones básicas primero"
    ]
  },
  "experiments": [
    {
      "result": "Confirmado - Atributo displayRules.frequency definido en block.json con estructura completa",
      "test_case": "Verificar atributo en block.json"
    },
    {
      "result": "Identificado - Ubicación ideal después del panel CSS Personalizado en línea ~617",
      "test_case": "Encontrar ubicación óptima en edit.js"
    }
  ],
  "implementation_plan": {
    "md_reference": "docs/memory/GUTENBERG_FREQUENCY_IMPLEMENTATION_20250719.md",
    "steps": [
      {
        "estimated_time": "20min",
        "status": "todo",
        "step": "Agregar PanelBody 'Reglas de Visualización' en edit.js"
      },
      {
        "estimated_time": "25min",
        "status": "todo",
        "step": "Implementar SelectControl con opciones de frecuencia"
      },
      {
        "estimated_time": "15min",
        "status": "todo",
        "step": "Conectar con setAttributes para displayRules.frequency"
      },
      {
        "estimated_time": "10min",
        "status": "todo",
        "step": "Agregar descripción explicativa del campo"
      },
      {
        "estimated_time": "30min",
        "status": "todo",
        "step": "Probar funcionalidad completa en editor"
      }
    ]
  },
  "links": {
    "designs": [],
    "docs": [],
    "runs": [],
    "tickets": []
  },
  "meta": {
    "author": "augment_agent",
    "date": "2025-07-19T09:40:00Z",
    "project": "ewm-modal-cta",
    "status": "todo",
    "task_id": "GUTENBERG_FREQUENCY_IMPLEMENTATION_20250719"
  },
  "next_actions": [
    "Localizar línea exacta de inserción en edit.js",
    "Implementar PanelBody con SelectControl",
    "Testear funcionalidad",
    "Verificar compatibilidad con bloques existentes"
  ],
  "open_questions": [
    "¿Se debe agregar también configuración de límite numérico?",
    "¿Se requiere preview de la configuración?"
  ],
  "problem": {
    "business_goal": "Implementar la UI faltante para configurar frecuencia de visualización en bloques Gutenberg, manteniendo consistencia con funcionalidad existente",
    "constraints": [
      "No modificar estructura de atributos existentes",
      "Mantener compatibilidad hacia atrás",
      "Usar componentes estándar de WordPress"
    ],
    "user_request": "Crear la implementación del campo de Frecuencia de Visualización en el editor de bloques Gutenberg"
  },
  "schema_version": "1.0.0",
  "scope": {
    "components": [
      "Gutenberg Block Editor",
      "PanelBody Component",
      "SelectControl Component",
      "Display Rules UI"
    ],
    "files": [
      "src/ewm-modal-cta/edit.js"
    ]
  },
  "strategies_tried": []
}