{
  "schema_version": "2.0.0",
  "meta": {
    "task_id": "BRAINSTORMING_TEORIAS_PERSISTENCIA_20250721",
    "status": "done",
    "date": "2025-07-21T07:30:00Z",
    "project": "ewm-modal-cta",
    "author": "augment_agent",
    "revision": 2,
    "snapshot_id": "29926768-69f3-4be8-b8a2-93b7eb739bb4",
    "group_id": "investigacion_ewm_modal_builder",
    "timestamp": "2025-07-21T12:01:28.618391Z",
    "can_agent_set_done": true,
    "rolled_back": false,
    "group_md": "groups/investigacion_ewm_modal_builder/group.md"
  },
  "scope": {
    "files": [
      "admin/class-ewm-modal-builder.php",
      "includes/class-ewm-rest-api.php",
      "admin/js/modal-builder.js",
      "assets/js/modal-admin.js"
    ],
    "components": [
      "Modal Builder",
      "Persistencia de Datos",
      "Frontend JavaScript",
      "REST API"
    ]
  },
  "problem": {
    "user_request": "Brainstorming e investigación profunda de teorías sobre por qué los cambios del modal no persisten",
    "business_goal": "Identificar todas las posibles causas del problema de persistencia",
    "constraints": [
      "Enfoque en JavaScript",
      "Sin Gutenberg",
      "Considerar que WP CLI hardcodeado funciona"
    ]
  },
  "analysis": {
    "root_cause": "INCONSISTENCIA ARQUITECTURAL IDENTIFICADA: Diferencia entre carga y guardado de datos",
    "hypotheses": [
      "CARGA: get_modal() usa campos separados (legacy)",
      "GUARDADO: update_modal() usa ewm_modal_config (unificado)",
      "Frontend recibe datos en formato legacy pero envía en formato unificado",
      "Conflicto entre estructura de datos de carga vs guardado"
    ],
    "tradeoffs": [
      "Corrección rápida vs refactoring completo",
      "Mantener compatibilidad vs simplificar arquitectura"
    ]
  },
  "implementation_plan": {
    "steps": [
      {
        "step": "Analizar flujo completo de guardado",
        "status": "done",
        "estimated_time": "45min"
      },
      {
        "step": "Investigar diferencias WP CLI vs Frontend",
        "status": "doing",
        "estimated_time": "30min"
      },
      {
        "step": "Documentar teorías y hipótesis",
        "status": "done",
        "estimated_time": "20min"
      }
    ],
    "md_reference": ""
  },
  "experiments": [
    {
      "test_case": "Analizar código de carga vs guardado",
      "result": "ENCONTRADA INCONSISTENCIA: get_modal() carga datos separados, update_modal() guarda unificado",
      "logs_link": "Ver líneas 324-334 en get_modal() vs 432-433 en create_modal()"
    }
  ],
  "strategies_tried": [
    {
      "strategy": "Revisar flujo completo de datos",
      "outcome": "Identificada causa raíz",
      "reason_for_failure": "No es fallo, es éxito - encontré el problema"
    }
  ],
  "open_questions": [
    "¿Por qué get_modal() no usa ewm_modal_config?",
    "¿Cómo WP CLI evita este problema?",
    "¿Deberíamos unificar la carga o el guardado?"
  ],
  "next_actions": [
    "Verificar por qué get_modal() usa estructura legacy",
    "Comprobar si WP CLI usa estructura unificada",
    "Proponer solución de unificación"
  ],
  "links": {
    "docs": [],
    "tickets": [],
    "designs": [],
    "runs": []
  }
}