{
  "analysis": {
    "hypotheses": [
      "Bypass granular con Options API mejor que WP_DEBUG",
      "Settings existentes se pueden extender"
    ],
    "root_cause": "Necesidad de control granular del bypass de frecuencia sin depender de WP_DEBUG",
    "tradeoffs": [
      "Control granular vs simplicidad",
      "Persistencia en DB vs variables de entorno"
    ]
  },
  "experiments": [],
  "implementation_plan": {
    "md_reference": "docs/memory/FREQUENCY_DEBUG_CONTROL_20250719.md",
    "steps": [
      {
        "estimated_time": "30min",
        "status": "done",
        "step": "Agregar frequency_debug_mode a EWM_Logger_Settings"
      },
      {
        "estimated_time": "15min",
        "status": "done",
        "step": "Crear interfaz checkbox en admin"
      },
      {
        "estimated_time": "20min",
        "status": "done",
        "step": "Modificar shortcodes.php para usar nueva configuración"
      },
      {
        "estimated_time": "10min",
        "status": "done",
        "step": "Agregar logging adicional para diagnóstico"
      },
      {
        "estimated_time": "15min",
        "status": "todo",
        "step": "Probar funcionalidad con checkbox activado/desactivado"
      }
    ]
  },
  "links": {
    "designs": [],
    "docs": [],
    "runs": [],
    "tickets": []
  },
  "meta": {
    "author": "agent_code",
    "date": "2025-07-19T21:35:00Z",
    "project": "ewm-modal-cta",
    "status": "review",
    "task_id": "FREQUENCY_DEBUG_CONTROL_20250719"
  },
  "next_actions": [
    "Llamar al líder para probar el nuevo control granular",
    "Verificar que checkbox aparece en admin",
    "Confirmar que bypass funciona solo cuando está activado"
  ],
  "open_questions": [],
  "problem": {
    "business_goal": "Control granular del bypass de frecuencia para testing sin depender de WP_DEBUG",
    "constraints": [
      "Debe integrarse con sistema de settings existente",
      "Debe ser fácil de usar para el líder"
    ],
    "user_request": "Crear función de bypass controlado granularmente usando Options API en lugar de WP_DEBUG"
  },
  "schema_version": "1.0.0",
  "scope": {
    "components": [
      "Logger Settings",
      "Shortcode frequency validation",
      "Admin interface"
    ],
    "files": [
      "includes/logging/class-ewm-logger-settings.php",
      "includes/class-ewm-shortcodes.php"
    ]
  },
  "strategies_tried": [
    {
      "outcome": "Éxito - sistema de settings ya existe y es extensible",
      "reason_for_failure": "N/A",
      "strategy": "Extender sistema de settings existente"
    },
    {
      "outcome": "Éxito - integración limpia con arquitectura actual",
      "reason_for_failure": "N/A",
      "strategy": "Usar patrón singleton de Logger_Settings"
    }
  ]
}