{
  "schema_version": "2.0.0",
  "meta": {
    "date": "2025-07-24T19:30:00Z",
    "project": "ewm-modal-cta",
    "author": "augment_agent",
    "task_id": "WC_BUILDER_INTEGRATION",
    "status": "doing",
    "revision": 1,
    "snapshot_id": "deeafe9b-c664-41ed-b8a7-f7c1861c178e",
    "group_id": "planes_pendientes",
    "can_agent_set_done": true,
    "rolled_back": false,
    "timestamp": "2025-07-24T19:32:25.771904Z",
    "group_md": "groups/planes_pendientes/group.md"
  },
  "scope": {
    "files": [
      "includes/class-ewm-admin-page.php",
      "assets/js/wc-builder-integration.js",
      "assets/js/modal-admin.js",
      "assets/css/modal-admin.css"
    ],
    "components": [
      "EWM_Admin_Page",
      "EWMWCBuilderIntegration",
      "EWMModalAdmin",
      "Modal Builder UI"
    ]
  },
  "problem": {
    "user_request": "Modificar el builder para integrar la funcionalidad de WooCommerce, agregando una pestaña específica para WooCommerce y conectando con el endpoint de cupones existente. Cuando se seleccione WooCommerce, los demás campos deben desaparecer.",
    "business_goal": "Facilitar la configuración de modales con integración WooCommerce desde el builder, permitiendo seleccionar cupones directamente y configurar opciones específicas de WooCommerce",
    "constraints": [
      "Usar el endpoint existente /ewm/v1/coupons",
      "Mantener compatibilidad con la funcionalidad existente",
      "Ocultar campos no relevantes cuando se selecciona WooCommerce"
    ]
  },
  "implementation_plan": {
    "steps": [
      {
        "step": "Agregar pestaña WooCommerce al builder en class-ewm-admin-page.php",
        "status": "doing",
        "estimated_time": "30min"
      },
      {
        "step": "Crear HTML para la configuración de WooCommerce en la nueva pestaña",
        "status": "todo",
        "estimated_time": "45min"
      },
      {
        "step": "Modificar JavaScript para manejar la lógica de mostrar/ocultar campos",
        "status": "todo",
        "estimated_time": "30min"
      },
      {
        "step": "Integrar wc-builder-integration.js con el builder principal",
        "status": "todo",
        "estimated_time": "30min"
      },
      {
        "step": "Agregar estilos CSS para la nueva pestaña",
        "status": "todo",
        "estimated_time": "15min"
      },
      {
        "step": "Probar la funcionalidad completa",
        "status": "todo",
        "estimated_time": "30min"
      }
    ]
  },
  "next_actions": [
    "Agregar pestaña WooCommerce al builder",
    "Crear formulario de configuración WooCommerce",
    "Implementar lógica de mostrar/ocultar campos"
  ]
}