{
  "analysis": {
    "hypotheses": [
      "Los field_ids se almacenan sin mapear a labels",
      "Falta procesamiento de configuración de campos en visualización",
      "Los labels están disponibles pero no se usan en la interfaz",
      "Necesita función de mapeo entre configuración y submissions"
    ],
    "root_cause": "Los submissions se almacenan con field_ids pero la visualización no mapeaba a labels disponibles en configuración del modal",
    "tradeoffs": [
      "Performance vs legibilidad - Se optó por legibilidad",
      "Compatibilidad con configuraciones existentes vs mejora UX - Se mantuvo compatibilidad"
    ]
  },
  "experiments": [
    {
      "logs_link": "",
      "result": "Configuración de modales contiene structure steps[].fields[] con id y label",
      "test_case": "Revisar estructura de configuración en class-ewm-render-core.php"
    }
  ],
  "implementation_plan": {
    "md_reference": "docs/memory/FIELD_MAPPING_INVESTIGATION_20250719.md",
    "steps": [
      {
        "estimated_time": "20min",
        "status": "done",
        "step": "Revisar estructura de almacenamiento en submissions"
      },
      {
        "estimated_time": "25min",
        "status": "done",
        "step": "Analizar configuración de campos en modales"
      },
      {
        "estimated_time": "30min",
        "status": "done",
        "step": "Localizar interfaz de visualización de leads"
      },
      {
        "estimated_time": "45min",
        "status": "done",
        "step": "Implementar mapeo field_id a label"
      },
      {
        "estimated_time": "20min",
        "status": "todo",
        "step": "Probar y validar solución"
      }
    ]
  },
  "links": {
    "designs": [],
    "docs": [],
    "runs": [],
    "tickets": []
  },
  "meta": {
    "author": "agent_code",
    "date": "2025-07-19T10:00:00Z",
    "project": "ewm-modal-cta",
    "status": "review",
    "task_id": "FIELD_MAPPING_INVESTIGATION_20250719"
  },
  "next_actions": [
    "Validar con lead existente",
    "Probar con diferentes tipos de modales"
  ],
  "open_questions": [],
  "problem": {
    "business_goal": "Mejorar legibilidad de leads mostrando labels de campos en lugar de field_ids técnicos",
    "constraints": [
      "Mantener compatibilidad con datos existentes",
      "No romper funcionalidad actual",
      "Preservar estructura de almacenamiento"
    ],
    "user_request": "Mapear campos de leads para mostrar labels legibles en lugar de field_XXXXX"
  },
  "schema_version": "1.0.0",
  "scope": {
    "components": [
      "Submission Management",
      "Lead Visualization",
      "Field Configuration",
      "Admin Interface"
    ],
    "files": [
      "includes/class-ewm-submission-cpt.php",
      "includes/class-ewm-modal-cpt.php",
      "includes/class-ewm-meta-fields.php"
    ]
  },
  "strategies_tried": [
    {
      "outcome": "EXITOSO - Mapeo implementado correctamente",
      "reason_for_failure": "N/A - Estrategia exitosa",
      "strategy": "Crear función get_field_mapping() que extrae labels de configuración del modal y aplicarla en render_data_meta_box()"
    }
  ]
}